{
  "schema_version": "0.2.0",
  "rubric_version": "0.2.0",
  "renderer_version": "0.2.0",
  "meta": {
    "title": "Here’s your AI Fluency Review",
    "generated_on": "",
    "review_period": "Latest 14 days",
    "coverage_line": ""
  },
  "evidence_inventory": {
    "unit": "work episode",
    "source_types": [],
    "periods": [],
    "inventoried_count": 0,
    "reviewed_count": 0,
    "sampling_method": "All accessible eligible episodes",
    "access_limits": [],
    "attribution_limits": []
  },
  "reliability": {
    "evidence_strength": "low",
    "limitations": []
  },
  "standouts": {
    "strongest_observed_habit": "",
    "current_focus": "",
    "try_next": ""
  },
  "areas": [
    {
      "id": "description",
      "display_label": "Brief the task",
      "research_label": "Description",
      "level": null,
      "evidence_strength": "low",
      "observed_pattern": "",
      "inconsistent_patterns": [],
      "evidence_gaps": [],
      "opportunities_to_observe": 0,
      "contexts_observed": 0,
      "rating_rationale": "",
      "recommended_action": "",
      "evidence": []
    },
    {
      "id": "delegation",
      "display_label": "Divide the work",
      "research_label": "Delegation",
      "level": null,
      "evidence_strength": "low",
      "observed_pattern": "",
      "inconsistent_patterns": [],
      "evidence_gaps": [],
      "opportunities_to_observe": 0,
      "contexts_observed": 0,
      "rating_rationale": "",
      "recommended_action": "",
      "evidence": []
    },
    {
      "id": "discernment",
      "display_label": "Check the result",
      "research_label": "Discernment",
      "level": null,
      "evidence_strength": "low",
      "observed_pattern": "",
      "inconsistent_patterns": [],
      "evidence_gaps": [],
      "opportunities_to_observe": 0,
      "contexts_observed": 0,
      "rating_rationale": "",
      "recommended_action": "",
      "evidence": []
    },
    {
      "id": "diligence",
      "display_label": "Finish responsibly",
      "research_label": "Diligence",
      "level": null,
      "evidence_strength": "low",
      "observed_pattern": "",
      "inconsistent_patterns": [],
      "evidence_gaps": [],
      "opportunities_to_observe": 0,
      "contexts_observed": 0,
      "rating_rationale": "",
      "recommended_action": "",
      "evidence": []
    },
    {
      "id": "adaptive-flexibility",
      "display_label": "Learn and adapt",
      "research_label": "Adaptive Flexibility",
      "level": null,
      "evidence_strength": "low",
      "observed_pattern": "",
      "inconsistent_patterns": [],
      "evidence_gaps": [],
      "opportunities_to_observe": 0,
      "contexts_observed": 0,
      "rating_rationale": "",
      "recommended_action": "",
      "evidence": []
    }
  ],
  "adaptive_flexibility_change": {
    "status": "not-enough-evidence",
    "summary": "Not enough evidence to evaluate change over time.",
    "baseline_period": null,
    "baseline_level": null,
    "friction": null,
    "changed_approach": null,
    "verified_result": null,
    "later_reuse": null,
    "evidence": []
  },
  "interaction_events": []
}
